id,slug,name,description,genres,tags,released,rating,platforms,image
11147,ark-survival-of-the-fittest,ARK: Survival Of The Fittest,"Welcome to ARK: Survival of the Fittest, the first ever M.O.S.A. - a Multiplayer Online Survival Arena - that Studio Wildcard designed for the burgeoning wild west of eSports. A spin-off from the most popular open-world Early Access game on Steam ARK: Survival Evolved, ARK: Survival of the Fittest (SotF) pits up to 72 combatants in an action-packed struggle for survival where players are ultimately pushed into an epic final showdown where only one “Tribe” will make it out alive.

Survivors can form one- to six-person Tribes with the options to choose Unofficial and Official (Ranked) servers, and a variety of game-lengths and sizes in which to play. Players will start in the base forest environment introduced in the original ARK: Survival Evolved, with new environments and creatures introduced as the game evolves. Dedicated eSport ranking, matchmaking, reward, and tournament features make ARK: SotF readily accessible to all players.

Balanced for intense competition, contestants begin in a neutral staging area where they can communicate pre-game, strategize, or talk trash. After a count-down, they dramatically descend from the sky onto the ARK in a circular formation via beams of light. There is a cache of valuable items in the center – do survivors dash for the goods and fight it out, do they run into the forest and hide, search for Dinosaurs to rapidly build their army, or do they freeze up from the sheer terror of death? A continually shrinking “ring of death” forces contestants ever closer together over time. The hunt is on!
KEY FEATURES
Action-Packed Core Survival Gameplay
30+ Creatures to Tame and Ride at Early Access Start, Many more planned at full launch
Multiple game modes (1v1, 2v2, 4v4, and 6v6)
One-to-Six Player Tribes
Variable game configurations ranging from 30-minute “instant action” to three-hour long “epic wars”
Top-ranked players are listed dynamically on SurviveTheArk.com and are provided monthly prize packages!
Game-Changing Tameable Super Creatures (Dragon, Giant Ape, Brood Mother)
Random “Evolution Events”
Arsenal of Weapons, Traps, Armor, Structures and other Items from Primitive to Modern Tech Tiers
Robust Ranking, Tournament & Spectator Features
Exclusive SotF Cosmetic Items that can also be used in ARK: Survival Evolved
Custom-Painted “War Banners” enable Tribes to show off their team spirit on Flags across their army of Dinosaurs, and are also broadcast on the gigantic billboards during game events. Just don’t draw anything offensive!
A custom soundtrack written by award-winning composer Gareth Coker of Ori and the Blind Forest!","Action, RPG, Strategy, Massively Multiplayer, Indie","Singleplayer, Multiplayer, RPG, Co-op, Open World, First-Person, Partial Controller Support, FPS, Exploration, Steam Leaderboards",2016-03-15,2.59,"Android, Linux, macOS, PC, iOS",https://media.rawg.io/media/games/095/0953bf01cd4e4dd204aba85489ac9868.jpg
4513,just-cause-2,Just Cause 2,"Just Cause II follows a story of Rico Rodriguez, who arrives yet on another fictional island. Previously being on the Caribbean, now he is coming to Panau - an island in Southeast Asia. This time, Rico has to overthrow the dictatorial regime with its leader, Pandak ""Baby"" Panay and confront his former mentor, Tom Sheldon. When Rico arrives at the island, he discovers three criminal gangs: The Roaches, The Reapers and the Ular Boys. In order to prevail, Rico has to fight all of the three fractions as well.

One of the key features of the game is speed. This game is filled with adrenaline and ways of doing things very fastly. A wide variety of vehicles such as planes, boats, cars and other. A grappling hook is also available for the player as he can make his character fly around like Spider-Man or tie enemies to each other. There is a big choice of weaponry as well - you can have a pistol, two pistols, auto-rifles or even a grenade launcher! Having an open world map provides a player with experience do whatever they please - flying around, making missions or just discovering new things on the island.","Action, Shooter","Singleplayer, Steam Achievements, Multiplayer, Full controller support, Steam Cloud, Atmospheric, Co-op, Open World, cooperative, Third Person",2010-03-23,3.62,"Xbox 360, PlayStation 3, Xbox One, PC",https://media.rawg.io/media/games/a3c/a3c529a12c896c0ef02db5b4741de2ba.jpg
4166,mass-effect,Mass Effect,"Mass Effect was the very start of the trilogy about Commander Shepard in his journey to save the universe from Reapers - an old civilisation that wants to kill every possible rational being in order to prevail any wars. You play as Shepard. With flexible backstory and different classes you travel to Eden Prime with Captain Anderson and Nihlus Kryik, you and your team must discover the mystery behind the attack on the human colony. In the process, it is revealed that another Spectre, Saron, has become rogue and escapes the planet to awoke Reapers and start a full-scale war with the galaxy.

For BioWare, third-person shooters with tactical elements is a very common genre. Four different weapons - automatic rifle, shotgun, pistol and sniper rifle can be obtained through the game with better characteristics. Also, you can level up your protagonist and his squad to gain better stats and new skills. Dialogue panel is simple yet efficient - you choose the style of your approach and build a reputation of a hero or a renegade. With this options in hand, you can build your own story as Commander Shepard in saving the Milky Way Galaxy.","Action, RPG","Singleplayer, Atmospheric, Great Soundtrack, RPG, Story Rich, Open World, Third Person, Sci-fi, Female Protagonist, Action RPG",2007-11-16,4.39,"Xbox One, Xbox 360, PlayStation 3, PC",https://media.rawg.io/media/games/a6c/a6ccd34125c594abf1a9c9821b9a715d.jpg
,fall-guys-ultimate-knockout,,,,,,0.0,,
3191,mad-max,Mad Max,"Although Mad Max is not related to the film series, it is based on its universe. Max Rockatansky is trying to reach the ""Plains Of Silence"", place in which he believes he will finally find peace. He is confronted by a group of War Boys led by Scabrous Scrotus. Beating Max up and stealing everything from him, they leave him in the desert to face his death. Recovering from his injuries, he chases Scrotus in a duel but fails to defeat him. Wandering in the desert, he meets a technic named Chumbucket that helps him to build a new machine and revenge Scrotus. 

Being in such esthetics, Max is able to travel in an open world post-apocalyptic universe of Mad Max. Utilizing driving as a primary mechanic, you are able to confront and battle your way out on the car while armed with different weapons. Flamethrowers, turbo-boosts, basically anything that may come handy. You can have your preference for playing stealthy or aggressive. To drive, you need gasoline and to customise your car you need experience which you will get over time. Experience all the consequences of being a survivor by driving through the wasteland.","Action, Adventure","Singleplayer, Multiplayer, Full controller support, Atmospheric, RPG, Open World, First-Person, Third Person, Exploration, Sandbox",2015-08-31,3.78,"PC, Xbox One, PlayStation 4, Xbox 360, Linux, macOS",https://media.rawg.io/media/games/d7d/d7d33daa1892e2468cd0263d5dfc957e.jpg
22509,minecraft,Minecraft,"One of the most popular games of the 2010s, Minecraft allows you to rebuild the environment around you. The world of the game is open, infinitely wide, and procedurally generated. It is composed of small 3D cubes that represent specific types of materials or terrain. The gameplay is centered on mining and building various structures of your choice. You can also craft items like tools, weapons, and armor. There's an option to shift to the first or the third person view.
Minecraft includes multiple modes that dramatically change the focus of the game. Survival and Adventure modes require the player to gather resources, hunt for food and fight monsters to survive. In the Hardcore mode, there’s even permanent death. Creative mode, by contrast, offers you to freely explore the world and construct whatever you want with unlimited resources. There’s also a multiplayer mode that allows the players to share their worlds and engage in the traditional MMO activities, such as player-vs-player combat.
Minecraft’s crude visual style, reminiscent of Lego cubes, became an iconic part of the popular culture. There are many myths and fan fiction surrounding the game, such as the legend of Herobrine, a rumored character that officially doesn’t exist.","Action, Simulation, Arcade, Massively Multiplayer, Indie","Multiplayer, Sandbox, 3D, Crafting, Building, vr mod, open-world, cube, modding, procedural-generation",2009-05-10,4.43,"Android, PS Vita, PlayStation 4, PlayStation 3, Xbox 360, Nintendo 3DS, Nintendo Switch, macOS, PC, iOS, Wii U, Xbox One, Linux",https://media.rawg.io/media/games/b4e/b4e4c73d5aa4ec66bbf75375c4847a2b.jpg
613,bastion,Bastion,"After the Calamity, most of the world was destroyed and seemingly everyone was turned to stone, except the Kid. As the Kid, players will have to flee collapsing city, in order to reach the Bastion, where the game’s narrator Rucks, will instruct players to collect the Cores. Most of the story will be told through the narration and music. 

Bastion is an action role-playing game with an isometric overview of the map. As players progress across the levels they will find and unlock collectible items and weapons. After completing said levels the Kid will find Cores, that are used to upgrade the Hub are of Bastion and unlock more features, like a blacksmith, arsenal or an item shop. Any level can be replayed if players missed any items or if they’re short on currency, called fragments. The Kid will also encounter challenge levels, where players will have to successfully use collected weapons under a time limit.

**Key Features**:
• Action-packed combat rewards playing with finesse
• Hours of reactive narration delivers a deep story
• Stunning hand-painted artwork in full 1080p resolution
• Critically-acclaimed original music score
• Controls custom-tailored to PC plus gamepad support
• 10+ unique upgradeable weapons to be used
• 6 powerful Bastion structures to be discovered
• 'New Game Plus' and 'Score Attack' modes unlocked after finishing the story
• 'No-Sweat Mode' lets players of any skill level enjoy the story","Action, Adventure, RPG, Indie","Singleplayer, Steam Achievements, Full controller support, Steam Cloud, Atmospheric, steam-trading-cards, Great Soundtrack, RPG, Story Rich, 2D",2011-07-20,4.15,"PlayStation 4, PS Vita, Xbox One, PC, iOS, Linux, Nintendo Switch, Xbox 360, macOS",https://media.rawg.io/media/games/f99/f9979698c43fd84c3ab69280576dd3af.jpg
25,middle-earth-shadow-of-war,Middle-earth: Shadow of War,"Middle-earth: Shadow of War is a continuation of Middle-earth: Shadow of Mordor
The game operates on the world and the characters of the books of JRR Tolkien. However, it will be more accurate to say that the game is closer to the cinematic version of this story, created by director Peter Jackson. This is noticeable both in the visual solutions of some locations, and in the events themselves and their location in time relative to each other.

Judging by the events, the game takes place between the events of the books ""The Hobbit"" and ""The Lord of the Rings"". However, in the game there are also such events as the fall of the city-fortress of Minas Ithil and its transformation into Minas Morgul - in books these events occur several thousand years earlier.

As in Middle-earth: Shadow of Mordor, in the game Middle-earth: Shadow of War, the Nemesis system operates. This system provides a change in the world of the game and its inhabitants from the actions of the player. Therefore, each passage differs from other passages. For the game Middle-earth: Shadow of War, the Nemesis system has been improved.

If the player has the game Middle-earth: Shadow of Mordor, he can transfer to Middle-earth: Shadow of War some characters from the previous game - one enemy and one ally.

The player controls Talion. Taleon is obsessed with the spirit of the elven ruler of Celebrimbor. Taleon tries to use one of the rings of power to build an army of orcs and trolls and fight with Sauron and his generals.","Action, RPG","Singleplayer, Steam Achievements, Full controller support, Steam Cloud, Atmospheric, steam-trading-cards, Great Soundtrack, RPG, Story Rich, Open World",2017-09-27,3.86,"PC, Xbox One, PlayStation 4, Android",https://media.rawg.io/media/games/21a/21ad672cedee9b4378abb6c2d2e626ee.jpg
10989,paladins,Paladins,"Paladins (also known as Paladins: Champions of the Realm) is a free-to-play multiplayer first-person shooter. The game is, according to developers, influenced by Team Fortress 2 and is an example of hero shooter subgenre: a type of multiplayer shooter in which you choose to play as one of the pre-made characters with unique abilities and weapons¬.  
The primary game mode in Paladins is the siege. Two teams are fighting for the capture point in the center of the map. When a team successfully seizes the capture point, it gets 1 Objective Point, and the Payload spawns for them. Now they must escort the Payload to the enemy’s base to get additional Objective Point. The hostile team can, however, steal the Payload to get Objective Point themselves. Once a team gets 4 Objective Points, it wins the match. 
There are more than 38 heroes (or “champions” as they are called in the game) available in Paladins. Initially, the player has access to 5 of them at any time, and 4 more are in a two-week rotation. To permanently get any other champion, the player has to buy the champion via in-game currency or buy the champions pack for real money.","Action, Shooter","Steam Achievements, Multiplayer, steam-trading-cards, Co-op, cooperative, First-Person, Partial Controller Support, FPS, Online Co-Op, Fantasy",2016-09-15,3.08,"macOS, PC, PlayStation 4, Xbox One, Nintendo Switch",https://media.rawg.io/media/games/d2c/d2c74dacd89fd817c2deb625b01adb1a.jpg
9810,ark-survival-evolved,ARK: Survival Evolved,"As a man or woman stranded naked, freezing and starving on the shores of a mysterious island called ARK, you must hunt, harvest resources, craft items, grow crops, research technologies, and build shelters to withstand the elements. Use your cunning and resources to kill or tame & breed the leviathan dinosaurs and other primeval creatures roaming the land, and team up with or prey on hundreds of other players to survive, dominate... and escape!
Dinosaurs, Creatures, & Breeding! -- over 100+ creatures can be tamed using a challenging capture-&-affinity process, involving weakening a feral creature to knock it unconscious, and then nursing it back to health with appropriate food. Once tamed, you can issue commands to your tames, which it may follow depending on how well you’ve tamed and trained it. Tames, which can continue to level-up and consume food, can also carry Inventory and Equipment such as Armor, carry prey back to your settlement depending on their strength, and larger tames can be ridden and directly controlled! Fly a Pterodactyl over the snow-capped mountains, lift allies over enemy walls, race through the jungle with a pack of Raptors, tromp through an enemy base along a gigantic brontosaurus, or chase down prey on the back of a raging T-Rex! Take part in a dynamic ecosystem life-cycle with its own predator & prey hierarchies, where you are just one creature among many species struggling for dominance and survival. Tames can also be mated with the opposite gender, to selectively breed successive generations using a trait system based on recombinant genetic inheritance. This process includes both egg-based incubation and mammalian gestation lifecycles! Or put more simply, raise babies!
You must eat and drink to survive, with different kinds of plants & meat having different nutritional properties, including human meat. Ensuring a supply of fresh water to your home and inventory is a pressing concern. All physical actions come at a cost of food and water, long-distance travel is fraught with subsistence peril! Inventory weight makes you move slower, and the day/night cycle along with randomized weather patterns add another layer of challenge by altering the temperature of the environment, causing you to hunger or thirst more quickly. Build a fire or shelter, and craft a large variety of customizable clothing & armors, to help protect yourself against locational damage & extreme temperatures using the dynamic indoor/outdoor insulation calculation system!
By chopping down forests full of trees and mining metal and other precious resources, you can craft the parts to build massive multi-leveled structures composed of complex snap-linked parts, including ramps, beams, pillars, windows, doors, gates, remote gates, trapdoors, water pipes, faucets, generators, wires and all manner of electrical devices, and ladders among many other types. Structures have a load system to fall apart if enough support has been destroyed, so reinforcing your buildings is important. All structures and items can be painted to customize the look of your home, as well as placing dynamically per-pixel paintable signs, textual billboards, and other decorative objects. Shelter reduces the extremes of weather and provides security for yourself and your stash! Weapons, clothing & armor gear can also be painted to express your own visual style.
Pick seeds from the wild vegetation around you, plant them in plots that you lay down, water them and nurture them with fertilizer (everything poops after consuming calories, which can then be composted, and some fertilizer is better than others). Tend to your crops and they will grow to produce delicious and rare fruits, which can also be used to cook a plethora of logical recipes and make useful tonics! Explore to find the rarest of plant seeds that have the most powerful properties! Vegetarians & vegans can flourish, and it will be possible to master and conquer the ARK in a non-violent manner!
By bringing sufficient rare sacrificial items to special Summon locations, you can capture the attention of the one of the ARK’s god-like mythical creatures, who will arrive for battle. These gargantuan monstrosities provide an end-game goal for the most experienced groups of players and their armies of tames, and will yield extremely valuable progression items if they are defeated.
Create a Tribe and add your friends to it, and all your tames can be commanded by and allied to anyone in your Tribe. Your Tribe will also be able to respawn at any of your home spawn points. Promote members to Tribe Admins to reduce the burden of management. Distribute key items and pass-codes to provide access your shared village!
All items are crafted from Blueprints that have variable statistics and qualities, and require corresponding resources. More remote and harsh locales across the ARK tend to have better resources, including the tallest mountains, darkest caves, and depths of the ocean! Level-Up your player character by gaining experience through performance actions, Level-Up your tames, and learn new ""Engrams"" to be able to craft Items from memory without the use of blueprints, even if you die! Customize the underlying physical look of your character with hair, eye, and skin tones, along with an array of body proportion modifiers. As you explore the vast ARK, you'll find clues left by other Survivors who have made the ARK their home in ages past, in the form of collectible detailed 3D ""Explorer Notes"". By uncovering all of these, you can begin to piece together the true nature of the ARK, and discover its purpose!
Everything you craft has durability and will wear-out from extended use if not repaired, and when you leave the game, your character remains sleeping in the persistent world. Your inventory physically exists in boxes or on your character in the world. Everything can be looted & stolen, so to achieve security you must build-up, team-up, or have tames to guard your stash. Death is permanent, and you can even knock out, capture, and force-feed other players to use them for your own purposes, such as extracting their blood to for transfusions, harvesting their fecal matter to use as fertilizer, or using them as food for your carnivorous tames!
The mysterious ARK is a formidable and imposing environment, composed of many natural and unnatural structures, above-ground, below-ground, and underwater. By fully exploring its secrets, you’ll find the most exotic procedurally randomized creatures and rare blueprints. Also to be found are Explorer Notes that are dynamically updated into the game, written by previous human denizens of the ARK from across the millennia, creatively detailing the creatures and backstory of the ARK and its creatures. Fully develop your in-game ARK-map through exploration, write custom points of interest onto it, and craft a Compass or GPS coordinates to aid exploring with other players, whom you can communicate with via proximity text & voice chat, or long-distance radio. Construct & draw in-game signs for other players to help them or lead them astray...  And yet.. how do you ultimately challenge the Creators and Conquer the ARK? A definitive end-game is planned.
On the 100+ player servers, your character, everything you built, and your tames, stay in-game even when you leave. You can even physically travel your character and items between the network of ARK's by accessing the Obelisks and uploading (or downloading) your data from the Steam Economy! A galaxy of ARKs, each slightly different than the previous, to leave your mark on and conquer, one at a time -- special official ARKs will be unveiled on the World-map for limited times in singular themed events with corresponding limited-run items! Furthermore, you can now design or randomize your own unique 'Procedurally Generated ARKs', for infinite replayability and endless surprises.
You can play single-player local games, and bring your character and items between unofficial player-hosted servers, back and forth from singleplayer to multiplayer. Mod the game, with full Steam Workshop support and customized Unreal Engine 4 editor. See how we built our ARK using our maps and assets as an example. Host your own server and configure your ARK precisely to your liking. We want to see what you create!
The over-the-top hyper real imagery of the ARK its creatures is brought to expressive life using a highly-customized Unreal Engine 4, with fully dynamic lighting & global illumination, weather systems (rain, fog, snow, etc) & true-to-life volumetric cloud simulation, and the latest in advanced DirectX11 and DirectX12 rendering techniques. Music by award-winning composer of ""Ori and the Blind Forest"", Gareth Coker!","Action, Adventure, RPG, Massively Multiplayer, Indie","Singleplayer, Steam Achievements, Multiplayer, Full controller support, Steam Cloud, RPG, Co-op, Open World, cooperative, First-Person",2015-06-02,3.07,"Nintendo Switch, Xbox One, PlayStation 4, Linux, macOS, PC, iOS",https://media.rawg.io/media/games/58a/58ac7f6569259dcc0b60b921869b19fc.jpg
480,resident-evil-7-biohazard,Resident Evil 7: Biohazard,"Resident Evil 7: Biohazard is the latest installment in the Resident Evil series. For 13 long years, Resident Evil series were rejecting the survival-horror aspect and atmosphere of first original games in the series mainly released in nineties on PlayStation one system. From the famous Resident Evil 4 until Resident Evil 6, the series went full-force into action genre leaving horror elements behind and hard-core fans disappointed. Finally, Capcom realized that Resident Evil needs a change and Resident Evil 7: Biohazard delivers those changes at its fullest. First of all, the camera angle changed from over the shoulder view into first-person mode. Another change is that survival-horror elements are back together with light puzzle solving, inventory management and maze-like mansion in which the main story of the game happens. The player controls Ethan Winters who is searching for his lost wife in a dark mansion filled with horrible creatures and insane family. 
Resident Evil 7: Biohazard can also be played with virtual reality setup and it’s known as one of the best games which supports VR.","Action, Shooter, Adventure","Singleplayer, Steam Achievements, Multiplayer, Full controller support, Steam Cloud, Atmospheric, steam-trading-cards, Story Rich, First-Person, Horror",2017-01-23,4.33,"macOS, PlayStation 4, PC, Xbox One, Nintendo Switch",https://media.rawg.io/media/games/cee/cee577e2097a59b77193fe2bce94667d.jpg
