id,slug,name,description,genres,tags,released,rating,platforms,image
3371,dark-souls-ii-scholar-of-the-first-sin,Dark Souls II: Scholar of the First Sin,"New take in the Souls series. This time players are offered to overcome the immense difficulties in the kingdom of Drangleic. On the way to becoming human again, the hero must obtain a few greater souls. Gamers will experience player versus environment as well as player versus player gameplay using dedicated server technology. Invite your friends, fight your foes and survive your way through harsh medieval fantasy land. 

The game shares with the first installment in the series the engine and game universe but is not connected in terms of story. Known for its difficulty the game offers players unbeatable challenge. Bad play is severely punished by the game: each time player dies game protagonist loses a bit of maximum health just like in Demon’s Souls.

Scholar of the First Sin bundles all previous DLCs for Dark Souls II as well as visual upgrades, new features and content.","Action, RPG","Singleplayer, Steam Achievements, Multiplayer, Full controller support, Atmospheric, RPG, Co-op, Story Rich, cooperative, Third Person",2015-04-01,4.15,"PlayStation 4, Xbox One, PC",https://media.rawg.io/media/games/8fc/8fc59e74133fd8a8a436b7e2d0fb36c2.jpg
16343,a-story-about-my-uncle,A Story About My Uncle,"A Story About My Uncle is a first-person adventure with a heavy focus on moving using a grappling hook and a non-violent approach thus making the plot and landscapes the critical focus of the gaming experience. There is no series of this game: it is the only title in the IP by Gone North also known as Goat Simulator creators. 
The core gameplay features are the energetic costume giving its owner the ability to jump higher and use the grappling hook, and various updates to this outfit, for example, jetpack boots. While mastering this Spider-Man-like potential, the hero encounters various non-hostile NPCs and environment, the only menacing obstacle in the game is a one-eyed worm, lurking in one of the caves. However, the worst scenario is that it blows you off the cliff. Worm likes to take a nap so getting over him is not a big deal.
The plot follows a boy looking for his uncle, Freud. His nephew, after a little research in his flat, has discovered the super costume and traveled to another dimension. There are some optional collectibles scattered across the world. We shall also meet Maddy, who helps us find a missing character","Adventure, Arcade, Casual, Indie, Platformer","Singleplayer, Steam Achievements, Full controller support, Steam Cloud, Atmospheric, steam-trading-cards, Great Soundtrack, Story Rich, Open World, First-Person",2014-05-27,3.15,"PC, macOS, Linux",https://media.rawg.io/media/games/37a/37a9536e92cf8fe3b60045aa75dbd41f.jpg
752,smite,SMITE,"Smite is a free-to-play MOBA game developed by Hi-Rez Studios.

Gods from multiple mythologies serve as playable characters in the game. Each god has three base abilities, one ultimate ability, and one passive ability. Each character can buy up to 6 passive items that grant stats bonuses and up to 2 active items that give the player new abilities such as teleporting or healing. Such items don't require mana but have a long recovery time.

The goal of the game is to destroy the opposing team's lane defenders and their Titan. Players are followed by minions that deal small amounts of damage to towers, lane defenders, the Titan or the opposing players.

Smite features a five-class system. Players are free to choose from assassin, warrior, mage, hunter and guardian classes. Each class has it's own specifics and should be carefully chosen according to the situation on the arena.

In contrast to other MOBA's, there are multiple game modes in Smite. The main differences between them are the amount of gold the players spawn with, the number of players, and the number of lanes.",Action,"Steam Achievements, Multiplayer, steam-trading-cards, RPG, Co-op, cooperative, Third Person, Funny, Survival, Free to Play",2015-08-19,3.05,"PlayStation 4, Nintendo Switch, Xbox One, macOS, PC",https://media.rawg.io/media/games/cc7/cc77035eb972f179f5090ee2a0fabd99.jpg
4440,deus-ex-human-revolution,Deus Ex: Human Revolution,"Deus Ex: Human Revolution is the third entry in the franchise and takes part as a prequel to the original Deus Ex. To save his life, Adam Jensen, a former SWAT officer must fill his body with augmentations. Humanity has battled any threat to it and now live in a cyberpunk world of future. When a new form of augmentations must be revealed, Sarif Industries is attacked by the group called the Tyrants. When Adam tries to save the facility, group leader Namir heavily wounds Jensen and kills Megan Reed. David Sarif saves Adam's life, and he places augmentations in his body making him a supernatural human being, Jensen must investigate the problem of extremists in the modern world.

One of the key features of the game is a flexible storyline. Based on your actions, the game will actually react to it by hiding some subplots or changing the main plot a little depending on your subject choices. The gameplay on its own is a stealth shooter with a big using implemented use of augmentations and experience system in order to level up your abilities.","Action, RPG","Stealth, Cyberpunk",2011-08-22,4.36,"PlayStation 3, Xbox One, PC, macOS, Xbox 360",https://media.rawg.io/media/games/81e/81e6c6819d4322caf375b6735c3043ec.jpg
16113,sleeping-dogs,Sleeping Dogs,"Sleeping Dogs is a third-person action shooter with RPG elements, having Hong Kong as its central location. The city is an open world for the player’s exploration, and many gameplay features revolve around interacting with the surroundings. A huge aspect of immersion would be music, as it is themed according to the geographical location of the city.
The main character Wei Shen finds himself in various situations which lead to the development of the main story. Resolving conflicts between local citizens and Hong Kong’s organized crime, the protagonist is offered to join one of the city’s gangs. Due to this, the players need to plan their actions carefully, building trust among both the gangsters and the police. 
The game features an unlock-based role-playing system, where every consecutive ability or trait is unlocked after the player achieves a specific goal or levels up character’s prestige in each of the three in-game groups. The combat system is heavily reliant on the character’s skill of martial arts, but conventional weaponry is also a favorable choice. Non-story related interactions add flavor to the overall gameplay, as there is a wide choice of how to spend the protagonist’s free time.","Action, Adventure","Singleplayer, Multiplayer, Full controller support, Atmospheric, Great Soundtrack, RPG, Story Rich, Open World, Third Person, Sandbox",2012-08-14,4.13,"PC, Xbox 360, PlayStation 3",https://media.rawg.io/media/games/3d9/3d9bac98d79bcd2d445f829e8d6be902.jpg
13194,to-the-moon,To the Moon,"Eva Rosalyn and Neil Watts give people a chance to live their lives ""one more time"" - they are operators of the machine capable of penetrating into the human consciousness and rewriting memory, fulfilling unrealised dreams in minds.
However, they do this only for those who are close to death, because such manipulation irreversibly cripples the body.
Their dying client now is old Johnny. First, doctors learn from his memory his past to find out why before his death he wants to fulfil such a strange desire - to go to the Moon.
Then there is a strong story about meetings and partings, about promises and losses. It ends well, but only in the patient's memories.
The gameplay consists of the study of small locations, the solution of simple puzzles and long, saturated dialogues. All this becomes fascinating thanks to the elaborated plot.","Action, Adventure, RPG, Casual, Indie","Singleplayer, Steam Achievements, Full controller support, Steam Cloud, Atmospheric, steam-trading-cards, Great Soundtrack, RPG, Story Rich, 2D",2011-01-10,4.29,"PC, Nintendo Switch, Android, Linux, iOS, macOS",https://media.rawg.io/media/games/fae/faebf3c8cbf30db3f46bfbecf6ada3d6.jpg
18336,alan-wakes-american-nightmare,Alan Wake's American Nightmare,"Alan Wake's American Nightmare is a third-person shooter game, a follow-up to 2010 Remedy Entertainment title Alan Wake. However, it is not a full-fledged sequel to the game but rather a spin-off. The game’s tone and style are much more light-hearted and comedic than in the original, and the color palette is significantly brighter. 
The game’s story takes place two years after the original game in a fictional town Night Springs, Arizona. The series protagonist, Alan Wake, must defeat his dark doppelganger, Mr. Scratch to escape the Dark Place. American Nightmare’s gameplay is very similar to that of the original game; however, this time it is much more action-oriented, rather than story-driven. Its combat is centered around the same chief combat mechanic – focusing the flashlight on enemies on making them vulnerable to weapon.","Action, Shooter","Singleplayer, Full controller support, Atmospheric, Story Rich, Third Person, Horror, Survival, Controller, Third-Person Shooter, Survival Horror",2012-02-22,3.41,"Xbox 360, PC, Xbox One",https://media.rawg.io/media/games/0b3/0b34647c42271600399b93d19b10f1aa.jpg
4101,bayonetta,Bayonetta,"Bayonetta is a slasher game developed by Platinum Games.

The game is set in a fictional European city of Vigrid. The main character is a witch named Bayonetta who fights angels with pistols and magic wishing only one thing: to recall everything happened to her.

Bayonetta is a third-person game. The player controls Bayonetta and uses close to medium range attacks, complicated combos and a wide variety of weaponry. Special Torture Attacks are present in the game when Bayonetta uses a torture weapon such as guillotine to execute an enemy. The Witch Time ability allows the player to slow down time after an enemy attack is successfully dodged.

As the plot advances, the player transforms Bayonetta to a panther or other animals in order to enhance her abilities. The game consists of several chapters with each having multiple parts. A scoring system is present in the game as a medal is awarded at the end of each mission. Special medals can be found scattered across the secret areas of the levels.","Action, Adventure","Singleplayer, Steam Achievements, Full controller support, Steam Cloud, Atmospheric, steam-trading-cards, Great Soundtrack, Third Person, Fantasy, Gore",2009-06-23,4.3,"PlayStation 4, PlayStation 3, Xbox 360, Wii U, PC, Xbox One, Nintendo Switch",https://media.rawg.io/media/games/bee/bee483efadcf9d7e657e52184316a34e.jpg
20406,team-fortress-classic,Team Fortress Classic,"A world whose atmosphere consists of fire and flying fragments of flesh. The shooting and explosions are just as natural in this world as the birds' singing in the forest. Without a continually working Hastings machine gun, you just do not survive. And it is necessary to forget about steps - running is better.
The game has six modes - each mode is different for the purpose of the game:
Capture the enemy flag on the enemy’s base and bring it to your base.
Set your flag on the territory of the enemy or in an area not occupied by anyone.
Bring one of the players - an unarmed ""civilian"" (but he does have an umbrella!) - to a safe place, do not let him be shot by enemy snipers.
Grab the ball (not the flag) and carry it to your base.
Grab more control points (not territories).
Capture places that are protected by enemies, or defend sites from invaders.
There are only two means to achieve the goal. The first is obvious - to kill as many strangers as possible, but better all at once. The second is to establish interaction with the players on your team. This game is created to play in a team. For a diversity, there are nine classes for players - each class has one unique weapon.","Action, Shooter, Massively Multiplayer","Multiplayer, Co-op, Story Rich, cooperative, First-Person, FPS, Online Co-Op, Funny, Classic, Retro",1999-04-01,2.93,"Linux, macOS, PC",https://media.rawg.io/media/games/abd/abdb7e589f0a8ccd36c0582673120b1e.jpg
306124,borderlands-game-of-the-year-enhanced,Borderlands Game of the Year Enhanced,"Discover the co-op shooter-looter that started it all, crammed with content and enhancements! Equip bazillions of guns as one of four trigger-happy mercenaries, each with unique RPG skills. Take on the lawless desolate planet Pandora in pursuit of powerful alien technology: The Vault. With new weapons, visual upgrades, all 4 add-on packs and more, enjoy the highly acclaimed FPS/RPG solo or together with friends!
Bazillions of Guns: Rocket-launching shotguns, enemy-torching revolvers, SMGs that fire lightning rounds, and tons more.
Radical Art Style: Traditional rendering techniques combined with hand-drawn textures give Borderlands its iconic style.
Intense Vehicular Combat: Behind the wheel, engage in frenetic vehicle-to-vehicle combat.
Co-op Frenzy: Tear through the opposition as a crew of up to 4.NEW:VISUALLY STUNNING: With improved character models, environments, weapons, and textures, Borderlands paired with a 4K display never looked so good.
NEW WEAPONS: There are already too many to count so we added more.
NEW CHARACTER HEADS: Be as beautiful as mom says you are.
NEW GOLD CHESTS AND KEYS: More loot!
AND MORE!PLUS: THE ZOMBIE ISLAND OF DOCTOR NED: Enter the corporate owned small town known as Jakobs Cove and put an end to the rumors of the walking “undead.” New areas, new missions, new enemies, Oh My!
MAD MOXXI’S UNDERDOME RIOT: Celebrate the grand opening of Marcus Bank by taking on hundreds of foes in the only competitive arena around where you’re coming back famous... or not at all.
THE SECRET ARMORY OF GENERAL KNOXX: Want more of the Borderlands story and more loot than you could possibly figure out what to do with? Add new guns, missions, vehicles and more!
CLAPTRAP’S NEW ROBOT REVOLUTION: This destructive adventure invites you to battle a vicious new threat, a massive uprising of your former friends: the claptraps.","Action, Shooter, RPG","Singleplayer, Steam Achievements, Multiplayer, Steam Cloud, Atmospheric, RPG, Open World, cooperative, First-Person, Partial Controller Support",2019-04-03,3.79,"PC, Nintendo Switch, PlayStation 4, Xbox One",https://media.rawg.io/media/games/df9/df988191048e92cf86dabd2987c47b62.jpg
45821,frostpunk,Frostpunk,"In an ultimately frozen world, people develop steam-powered technology to oppose the overwhelming cold. The city ruler has to manage both the inhabitants and the infrastracture the citizens live in. Leader’s tactical skills face challenges, frequently questioning morality and the basic foundation of what we consider an organized society. Here optimization and resource management often clash with empathy and thoughtful decision-making. While city and society management consume most of the ruler’s time, at some point exploration of outside world is necessary to understand its history and present state.
What decisions will you make so the society can survive? What will you do when pushed to the limits? And...
...who will you become in the process?

THE CITY MUST SURVIVE
Frostpunk is a city-survival game where heat means life and every decision comes with a cost.

MAINTAIN THE HOPE
Survival is about hope and will to live. Your ability to spark and maintain these two in your people will be a determinant factor for success.

MAKE THE LAW
Society is a group of people abiding the same rules and sharing similar beliefs. Establishing laws and customs will be a crucial factor shaping your society.

WEIGHT YOUR CHOICES
Will you allow child-labour? How will you treat the sick and wounded? Frostpunk challenges a player’s tactical skills, while questioning one’s morality.

EXPLORE
The world covers not only bits of the past but also the potential means to secure the future of your people.

""(...) this is a game about finding reasons to survive rather than just the means to go on living.""
- Adam Smith, Rock, Paper, Shotgun
""In a steampunk ice age, the only thing that can be crueler than the bitter cold are the decisions you have to make to keep your people alive.""
- Stephanie Chan, VentureBeat
""(...) decisions push your morality to its limits for the sake of productivity, which could make for an captivating, draining adventure when the game releases later this year.""
- Suriel Vazquez, Game Informer","Strategy, Simulation","Singleplayer, Atmospheric, Difficult, Survival, Dark, Post-apocalyptic, Choices Matter, Building, Management, Real-Time with Pause",2018-04-24,4.19,"Xbox One, Nintendo Switch, PlayStation 4, PC",https://media.rawg.io/media/games/a88/a886c37bf112d009e318b106db9d420a.jpg
22121,celeste,Celeste,"Celeste is a platformer about climbing a mountain, from the creators of TowerFall.
Explore a sprawling mountain with over 500 levels bursting with secrets, across 8 unique areas. Unlock a hardcore Remix for each area, with completely new levels that will push your climbing skills to the limit.
Madeline can air-dash and climb any surface to gain ground. Controls are simple and accessible, but super tight and expressive with layers of depth to master. Deaths are sudden and respawns are fast. You'll die a lot, but you'll learn something every time.
Meet peculiar characters and climb through a personal story of breaking through your self-doubt to find yourself, set in the present-day Pacific Northwest. Uncover the mystery of the mountain's power and outrun your reflection on your journey to reach the top.","Indie, Platformer","Singleplayer, Steam Achievements, Full controller support, Steam Cloud, Story Rich, 2D, Horror, Female Protagonist, celeste, xna",2018-01-25,4.38,"Xbox One, PC, macOS, Nintendo Switch, PlayStation 4, Linux",https://media.rawg.io/media/games/594/59487800889ebac294c7c2c070d02356.jpg
,call-of-duty-black-ops-ii,,,,,,0.0,,
12756,warhammer-40000-space-marine,"Warhammer 40,000: Space Marine","Reviews
Steam Big Picture
About the GameIn Warhammer® 40,000® Space Marine® you are Captain Titus, a Space Marine of the Ultramarines chapter and a seasoned veteran of countless battles.
A millions-strong Ork horde has invaded an Imperial Forge World, one of the planet-sized factories where the war machines for humanity’s never ending battle for survival are created. Losing this planet is not an option and be aware of the far more evil threat lurking large in the shadows of this world.
DEVASTATING WEAPONRY
Experience 40,000 years of combat, evolved. Enhance your vast arsenal as you unlock new weapons, upgrades, armor & abilities through an accessible progression system. This devastating weaponry empowers players to deliver bone crushing violence and dismemberment to their enemies.
BLOCKBUSTER ENTERTAINMENT
With an Imperial liberation fleet en-route, the Ultramarines are sent in to hold key locations until reinforcements arrive. Captain Titus and a squad of Ultramarine veterans use the bolter and chainsword to take the fight to the enemies of mankind.
BRUTAL 8VS8 ONLINE COMBAT
Form your own Space Marine squad or Chaos Space Marine warband and face off in 8 vs 8 online matches. Gain experience and unlock new weapons and armor to customize the Devastator, Assault, and Tactical Marine classes.","Action, Shooter","Singleplayer, Steam Achievements, Multiplayer, Full controller support, Atmospheric, Great Soundtrack, Co-op, Story Rich, cooperative, Third Person",2011-09-05,3.47,"PC, PlayStation 3, Xbox 360",https://media.rawg.io/media/games/ac2/ac25b5cef220bf5b8d052e0978451cab.jpg
4573,payday-the-heist,PAYDAY The Heist,"PAYDAY The Heist is a dynamic co-op shooter that allows players to assume the role of a bank robber and to try on the criminal life from the first-person view. This game is the first part of the PAYDAY series and the beginning of the story of four outlaws – Dallas, Hoxton, Chains and Wolf. The gameplay is about completing 6 different heists throughout America alone (with bots) or in a team (up to 4 members). Each robbery could be carried out in two separate ways: players should decide whether stealth or a breakthrough attack is more suitable and prepare all the ammunition properly in advance. The squad of criminals searching for another “big score” is set up against easy-to-manipulate civilians and powerful police forces, so players are to try their best to prevent the alarm signals and not to face armed resistance. However, if the heavy combat begins, the best option will be to keep shooting countless enemies down till the money is in the bag and the heist is over.","Action, Shooter","Singleplayer, Steam Achievements, Multiplayer, Steam Cloud, steam-trading-cards, Great Soundtrack, RPG, Co-op, cooperative, First-Person",2011-10-18,3.34,"PC, PlayStation 3",https://media.rawg.io/media/games/546/546cf59a24b0ae308e311a07611ca22f.jpg
4094,metal-gear-rising-revengeance,Metal Gear Rising: Revengeance,"After the events of the uprising took four years. Naomi Hunter creates the FOXAVILE computer virus that destroys the system of ""Sons of the Patriots"", thereby putting an end to the military economy, what turned the war into a profitable business. PMSC (Private Military Security Companies) began to protect essential people and act as peacekeepers. You play as Raiden, a katana-wielding cyborg who is forced to join the PMSC to protect his family.

Most of the gameplay Raiden has to cut enemies and some objects with a mighty high-frequency sword. Along with the standard attacks available ""Free sword mode"" that allows you to control the assault. In the open mode, attacks are more powerful, but the range of their impact is lower. For the elimination of enemies in Free mode are given points that allow you to restore health and the scale of the free sword with the help of fluids that are in the spine of dead cyborgs.

Being undetected, you can perform silent and quick kills on some enemies approaching from behind or from above. Available, at least, ten kinds of weapons and a few suits.",Action,"Singleplayer, Steam Achievements, Full controller support, Steam Cloud, Great Soundtrack, Story Rich, Third Person, Sci-fi, Gore, Difficult",2013-02-19,4.25,"PlayStation 3, Xbox 360, PC, Android, Xbox One",https://media.rawg.io/media/games/8e6/8e699e91cf77c2060b6d515e2135b1b1.jpg
15426,black-mesa,Black Mesa,"Black Mesa is the original Half-Life as if it was made in the 21st century using modern graphics and updated mechanics. This remake of the classic game was envisioned by a group of enthusiasts, approved by Valve, and spent eight years in the making. The name, Black Mesa, refers to the secret research facility where the game is set. The player assumes the role of Gordon Freeman, a scientist caught in the midst of an experiment gone wrong. An anomaly breaks out, and hordes of monsters invade Black Mesa.
While Black Mesa and Half-Life are basically the same game, there are many subtle changes besides the improved graphics. The amount of ammo has changed, as well as the order in which the weapons appear in the game. The iconic crowbar is found in a different place. There are also new options like zooming in and out and reprogramming gun turrets. Some of the levels were shortened, and some of the monsters became stronger. NPCs became more intelligent, and they will perform certain actions to aid Gordon. Design of the characters also became more varied, and women finally appeared in the game. Black Mesa also introduced an achievement system and a multiplayer mode.","Action, Shooter, Indie","Singleplayer, Multiplayer, Atmospheric, Great Soundtrack, Co-op, Story Rich, First-Person, Sci-fi, Partial Controller Support, Horror",2020-03-06,4.35,"PC, Linux",https://media.rawg.io/media/games/009/009e4e84975d6a60173ec1199db25aa3.jpg
14512,age-of-wonders-iii,Age of Wonders III,"Age of Wonders 3 is a turn-based strategy game developed by Triumph Studios. It is the fourth title in the Age of Wonders game series.

###Story
Age of Wonders 3 is a fantasy game. It tells the story of a conflict between the Commonwealth Empire and the alliance of dark and forest elves. While the Commonwealth desires to take over the world and push all the old customs and traditions aside, elves fight to prevent such a thing from ever happening. Elves gather all the oppressed races and nations together to take the fight back to humans.

###Gameplay
Age of Wonders 3 gameplay is based around a 4X principle, which focuses on exploration, expansion, exploitation, and extermination. The players slowly build up their empire from the ground up. Multiple ways of achieving that are available, such as diplomacy, colonization, or plain old simple war. 

At the beginning of the game, the players choose and customize the character they will play as. This character becomes a leader of a specific nation in the game. Six races are available. The races have their own perks, which must be carefully chosen to suit the player's play style. 

The leader and empire perk trees are present in the game. As the players build up their empire, new units and buildings become available. There are 6 leader classes available for the players. Leaders can gain experience and level themselves up. The game also features a karma system, which influences the way the players are seen by their people.","RPG, Strategy","Singleplayer, Steam Achievements, Multiplayer, Steam Cloud, Atmospheric, steam-trading-cards, Great Soundtrack, RPG, Co-op, cooperative",2014-03-31,2.91,"PC, macOS, Linux",https://media.rawg.io/media/games/f95/f95ec06eddda5c5bf206618c49cd3e68.jpg
