id,slug,name,description,genres,tags,released,rating,platforms,image
3498,grand-theft-auto-v,Grand Theft Auto V,"Rockstar Games went bigger, since their previous installment of the series. You get the complicated and realistic world-building from Liberty City of GTA4 in the setting of lively and diverse Los Santos, from an old fan favorite GTA San Andreas. 561 different vehicles (including every transport you can operate) and the amount is rising with every update. 
Simultaneous storytelling from three unique perspectives: 
Follow Michael, ex-criminal living his life of leisure away from the past, Franklin, a kid that seeks the better future, and Trevor, the exact past Michael is trying to run away from. 
GTA Online will provide a lot of additional challenge even for the experienced players, coming fresh from the story mode. Now you will have other players around that can help you just as likely as ruin your mission. Every GTA mechanic up to date can be experienced by players through the unique customizable character, and community content paired with the leveling system tends to keep everyone busy and engaged.

Español
Rockstar Games se hizo más grande desde su entrega anterior de la serie. Obtienes la construcción del mundo complicada y realista de Liberty City de GTA4 en el escenario de Los Santos, un viejo favorito de los fans, GTA San Andreas. 561 vehículos diferentes (incluidos todos los transportes que puede operar) y la cantidad aumenta con cada actualización.
Narración simultánea desde tres perspectivas únicas:
Sigue a Michael, ex-criminal que vive su vida de ocio lejos del pasado, Franklin, un niño que busca un futuro mejor, y Trevor, el pasado exacto del que Michael está tratando de huir.
GTA Online proporcionará muchos desafíos adicionales incluso para los jugadores experimentados, recién llegados del modo historia. Ahora tendrás otros jugadores cerca que pueden ayudarte con la misma probabilidad que arruinar tu misión. Los jugadores pueden experimentar todas las mecánicas de GTA actualizadas a través del personaje personalizable único, y el contenido de la comunidad combinado con el sistema de nivelación tiende a mantener a todos ocupados y comprometidos.",Action,"Singleplayer, Steam Achievements, Multiplayer, Full controller support, Atmospheric, Great Soundtrack, RPG, Co-op, Open World, cooperative",2013-09-17,4.47,"PC, PlayStation 5, Xbox Series S/X, PlayStation 4, PlayStation 3, Xbox 360, Xbox One",https://media.rawg.io/media/games/20a/20aa03a10cda45239fe22d035c0ebe64.jpg
3328,the-witcher-3-wild-hunt,The Witcher 3: Wild Hunt,"The third game in a series, it holds nothing back from the player. Open world adventures of the renowned monster slayer Geralt of Rivia are now even on a larger scale. Following the source material more accurately, this time Geralt is trying to find the child of the prophecy, Ciri while making a quick coin from various contracts on the side. Great attention to the world building above all creates an immersive story, where your decisions will shape the world around you.

CD Project Red are infamous for the amount of work they put into their games, and it shows, because aside from classic third-person action RPG base game they provided 2 massive DLCs with unique questlines and 16 smaller DLCs, containing extra quests and items.

Players praise the game for its atmosphere and a wide open world that finds the balance between fantasy elements and realistic and believable mechanics, and the game deserved numerous awards for every aspect of the game, from music to direction.","Action, RPG","Singleplayer, Full controller support, Atmospheric, Great Soundtrack, RPG, Story Rich, Open World, Third Person, Fantasy, Sandbox",2015-05-18,4.64,"Xbox Series S/X, PlayStation 5, macOS, PlayStation 4, Nintendo Switch, PC, Xbox One",https://media.rawg.io/media/games/618/618c2031a07bbff6b4f611f10b6bcdbc.jpg
4200,portal-2,Portal 2,"Portal 2 is a first-person puzzle game developed by Valve Corporation and released on April 19, 2011 on Steam, PS3 and Xbox 360. It was published by Valve Corporation in digital form and by Electronic Arts in physical form. 

Its plot directly follows the first game's, taking place in the Half-Life universe. You play as Chell, a test subject in a research facility formerly ran by the company Aperture Science, but taken over by an evil AI that turned upon its creators, GladOS. After defeating GladOS at the end of the first game but failing to escape the facility, Chell is woken up from a stasis chamber by an AI personality core, Wheatley, as the unkempt complex is falling apart. As the two attempt to navigate through the ruins and escape, they stumble upon GladOS, and accidentally re-activate her...

Portal 2's core mechanics are very similar to the first game's ; the player must make their way through several test chambers which involve puzzles. For this purpose, they possess a Portal Gun, a weapon capable of creating teleportation portals on white surfaces. This seemingly simple mechanic and its subtleties coupled with the many different puzzle elements that can appear in puzzles allows the game to be easy to start playing, yet still feature profound gameplay. The sequel adds several new puzzle elements, such as gel that can render surfaces bouncy or allow you to accelerate when running on them.

The game is often praised for its gameplay, its memorable dialogue and writing and its aesthetic. Both games in the series are responsible for inspiring most puzzle games succeeding them, particularly first-person puzzle games. The series, its characters and even its items such as the portal gun and the companion cube have become a cultural icon within gaming communities.

Portal 2 also features a co-op mode where two players take on the roles of robots being led through tests by GladOS, as well as an in-depth level editor.","Shooter, Puzzle","Singleplayer, Steam Achievements, Multiplayer, Full controller support, Steam Cloud, Atmospheric, steam-trading-cards, Co-op, Story Rich, cooperative",2011-04-18,4.58,"PlayStation 3, PC, Xbox 360, Linux, macOS, Xbox One",https://media.rawg.io/media/games/2ba/2bac0e87cf45e5b508f227d281c9252a.jpg
4291,counter-strike-global-offensive,Counter-Strike: Global Offensive,"Counter-Strike is a multiplayer phenomenon in its simplicity. No complicated narratives to explain the source of the conflict, no futuristic and alien threats, but counter-terrorists against terrorists. Arena shooter at its core, CS:GO provides you with various methods of disposing enemies and reliant on cooperation within the team. During the round of the classical clash mode, you will gradually receive currency to purchase different equipment. Each player can carry a primary weapon, secondary pistol, knife and a set of grenades, which all can change the battle if wielded by the skilled player. 
Objectives are clear and vary from map to map, from game mode to game mode. Stop the terrorists from planting explosives, stop the counter-terrorist from retrieving the hostages, kill everyone who isn’t you and just perform the best with.
CS:GO is one of the major cybersport discipline, which makes playing it more exciting to some players. Aside from purchasing the game, CS:GO is infamous for its loot case system, that requires players to purchase keys, in order to open said cases. Customization items consist of weapon skins, weapon stickers, and sprays that do not affect gameplay and have purely visual value to the player.",Shooter,"Steam Achievements, Multiplayer, Full controller support, steam-trading-cards, Co-op, cooperative, First-Person, FPS, Online Co-Op, Tactical",2012-08-21,3.57,"PC, Linux, Xbox 360, PlayStation 3",https://media.rawg.io/media/games/736/73619bd336c894d6941d926bfd563946.jpg
13536,portal,Portal,"Every single time you click your mouse while holding a gun, you expect bullets to fly and enemies to fall. But here you will try out the FPS game filled with environmental puzzles and engaging story. 
Silent template for your adventures, Chell, wakes up in a testing facility. She’s a subject of experiments on instant travel device, supervised by snarky and hostile GLaDOS.
Players will have to complete the tests, room by room, expecting either reward, freedom or more tests. By using the gun, that shoots portals (Portal-Gun™), players will move blocks, travel great distance quickly and learn about your current situation, which is unraveled through environmental storytelling. What you will be told might be different from what you will see.
White environments will guide the player’s portal placement, forcing them to pay attention to the surroundings.  Portal creates tension, allowing either solving puzzles at your own leisure or moving quickly, due to the time limit or threats.","Action, Puzzle","Singleplayer, Steam Achievements, Atmospheric, Great Soundtrack, Story Rich, First-Person, Sci-fi, Partial Controller Support, FPS, Funny",2007-10-09,4.49,"macOS, PC, Android, PlayStation 3, Xbox 360, Linux, Nintendo Switch",https://media.rawg.io/media/games/7fa/7fa0b586293c5861ee32490e953a4996.jpg
12020,left-4-dead-2,Left 4 Dead 2,"Cooperative survival continues with a different set of characters. New survivors are making their way through 5 campaigns with an added ability to play through the story of the first game as well, using not only expanded arsenal of 20 ranged and 10 melee weapons but improved AI Director. Your surroundings and weather will change; enemy and item placement will differ from map to map, from difficulty to difficulty. New unique special zombies, placed in the unlucky for the player spot, can end your run.
High compatibility with community mods will allow you not only to add user-created maps but player models, enemy models, and even in-game music, which will help any player to create the unique experience on top of solid game mechanics.
Competitive multiplayer mods from arena survival to a head-on competition with another team of survivors are addictive and, in addition to the campaign, will provide you with hundreds of hours of game content.","Action, Shooter","Singleplayer, Steam Achievements, Multiplayer, Full controller support, Steam Cloud, steam-trading-cards, Co-op, cooperative, First-Person, Horror",2009-11-17,4.09,"Xbox 360, Linux, PC, macOS",https://media.rawg.io/media/games/d58/d588947d4286e7b5e0e12e1bea7d9844.jpg
5679,the-elder-scrolls-v-skyrim,The Elder Scrolls V: Skyrim,"The fifth game in the series, Skyrim takes us on a journey through the coldest region of Cyrodiil. Once again player can traverse the open world RPG armed with various medieval weapons and magic, to become a hero of Nordic legends –Dovahkiin, the Dragonborn. After mandatory character creation players will have to escape not only imprisonment but a fire-breathing dragon. Something Skyrim hasn’t seen in centuries.","Action, RPG","Singleplayer, Steam Achievements, Steam Cloud, Atmospheric, steam-trading-cards, Great Soundtrack, RPG, Story Rich, Open World, First-Person",2011-11-11,4.42,"PC, Xbox Series S/X, PlayStation 5, Xbox One, PlayStation 4, Nintendo Switch, Xbox 360, PlayStation 3",https://media.rawg.io/media/games/7cf/7cfc9220b401b7a300e409e539c9afd5.jpg
28,red-dead-redemption-2,Red Dead Redemption 2,"America, 1899. The end of the wild west era has begun as lawmen hunt down the last remaining outlaw gangs. Those who will not surrender or succumb are killed. 

After a robbery goes badly wrong in the western town of Blackwater, Arthur Morgan and the Van der Linde gang are forced to flee. With federal agents and the best bounty hunters in the nation massing on their heels, the gang must rob, steal and fight their way across the rugged heartland of America in order to survive. As deepening internal divisions threaten to tear the gang apart, Arthur must make a choice between his own ideals and loyalty to the gang who raised him.

From the creators of Grand Theft Auto V and Red Dead Redemption, Red Dead Redemption 2 is an epic tale of life in America at the dawn of the modern age.",Action,"Singleplayer, Multiplayer, Atmospheric, Great Soundtrack, Co-op, Story Rich, Open World, First-Person, Third Person, Partial Controller Support",2018-10-26,4.59,"PC, PlayStation 4, Xbox One",https://media.rawg.io/media/games/511/5118aff5091cb3efec399c808f8c598f.jpg
4062,bioshock-infinite,BioShock Infinite,"The third game in the series, Bioshock takes the story of the underwater confinement within the lost city of Rapture and takes it in the sky-city of Columbia. Players will follow Booker DeWitt, a private eye with a military past; as he will attempt to wipe his debts with the only skill he’s good at – finding people. Aside from obvious story and style differences, this time Bioshock protagonist has a personality, character, and voice, no longer the protagonist is a silent man, trying to survive.
Open and bright level design of Columbia shows industrial colonial America in a seemingly endless carnival. But Bioshock is not famous for its visuals, but for its story.  Mystery and creative vision of Irrational Games invite players to uncover the secrets of Columbia’s leader - Zachary Comstock and save Elizabeth, the girl, that’s been locked up in the flying city since her birth.
Unique weapons and mechanics of Vigor will make encounters different, helping players to adjust to the new found mobility and hook shot, making fights fast-paced and imaginative.","Action, Shooter","Singleplayer, Steam Achievements, Full controller support, Steam Cloud, Atmospheric, steam-trading-cards, Great Soundtrack, RPG, Story Rich, First-Person",2013-03-26,4.38,"PlayStation 4, Xbox 360, Nintendo Switch, Linux, PC, PlayStation 3, Xbox One",https://media.rawg.io/media/games/fc1/fc1307a2774506b5bd65d7e8424664a7.jpg
13537,half-life-2,Half-Life 2,"Gordon Freeman became the most popular nameless and voiceless protagonist in gaming history. He is painted as the most famous scientist and a hero within the world of Half-Life, and for a good reason. In the first game he saved the planet from alien invasion, this time, when the invasion is already begun, the world needs his help one more time. And you, as a player, will help this world to survive. This time Gordon arrives in City 17, ravaged and occupied by Combines, where he meets his old Black Mesa friends. 
What is different, aside from the overall design quality, is the use of Valve’s Source engine that not only expands on the fluidity of character model animations and movement but allows players to interact with a myriad of objects with the advanced and realistic (to an extent) physics. Classic Headcrab Zombies are revamped and have new variants that provide players with different threats. For a story-driven FPS, Half-Life 2 is unique in its plot delivery, and making in-game mechanics feel natural, be it platforming or driving.","Action, Shooter","Singleplayer, Steam Achievements, Multiplayer, Steam Cloud, Atmospheric, steam-trading-cards, Great Soundtrack, Story Rich, First-Person, Sci-fi",2004-11-16,4.48,"PC, macOS, Xbox 360, Linux, Xbox, Android",https://media.rawg.io/media/games/b8c/b8c243eaa0fbac8115e0cdccac3f91dc.jpg
802,borderlands-2,Borderlands 2,"Sequel to the 4-player cooperative FPS RPG Borderlands, where the new team of Vault Hunters arrives on the infamous planet Pandora in order to get the riches, hidden inside the Vault, and help to free the planet from the Handsome Jack, President of Hyperion. Clear out the endless waves and groups and marauders with various weapon types and character abilities.
Unlike the first game, Borderlands 2 provided DLC not only expanding the world of Pandora with stand-alone story campaigns but adding 2 more characters. Now the main cast consists of Gunzerker Salvador(dual-wields guns at command), Siren Maya (holds and paralyzes the enemy), Commando Axton (summons turrets) and Zer0 the Assasin (invisible sniper ninja). But with the DLC players can try out summoning giant flying robots with Gaige the Mechromancer and Krieg the Psycho. 
Most of the game charm and popularity of Borderlands 2 comes from the supporting cast and the personalities of the NPC, making this fast-paced shooter with optional cover stand out.","Action, Shooter, RPG","Singleplayer, Steam Achievements, Multiplayer, Full controller support, Steam Cloud, Atmospheric, steam-trading-cards, RPG, Co-op, Open World",2012-09-18,4.01,"PlayStation 3, macOS, PC, Android, Linux, PS Vita, Xbox 360",https://media.rawg.io/media/games/49c/49c3dfa4ce2f6f140cc4825868e858cb.jpg
,life-is-strange,,,,,,0.0,,
4286,bioshock,BioShock,"FPS with RPG elements, Bioshock invites players to experience horrors of underwater isolation in the city of Rapture, the failed project of the better future. After surviving the plane crash, the protagonist has only one way to go – to the giant lighthouse that opens a way to the underwater utopia. Players will have to unravel the complicated history of Rapture, relying only on themselves, their guns and Plasmids, a mystical substance, that allows it’s user to obtain near magical abilities.
The atmosphere of isolation and threat is conveyed through the environmental sounds, subtle electrical buzzing and audio logs, telling the story of societal decay and despair. Players will shape the story, making moral choices along their way, saving Little Sisters or extracting ADAM, the mystical fuel for your abilities. While exploring the underwater city, players will complete missions for the last sane inhabitants of Rapture, while fending off the less fortunate ones.","Action, Shooter","Singleplayer, Atmospheric, Great Soundtrack, RPG, Story Rich, First-Person, Sci-fi, Partial Controller Support, Horror, FPS",2007-08-21,4.36,"PlayStation 3, macOS, PC, Xbox 360",https://media.rawg.io/media/games/bc0/bc06a29ceac58652b684deefe7d56099.jpg
32,destiny-2,Destiny 2,"Destiny 2 is an online multiplayer first-person shooter. You take on the role of a Guardian that needs to protect the last city on Earth from alien invaders. The game follows its predecessor, Destiny. The goal of the game is to return the Light that was stolen from the Guardians by the aliens.
Destiny 2 features two main activity types: player versus environment and player versus player. PvE is focused on exploration, story missions interaction with NPCs and side quests. PvP features 4v4 team matches in different modes. The game also allows taking part in group missions, such as three-player strikes and six-player raids.
Destiny 2 has a strong RPG aspect that includes character customization and development. There are three classes in the game - Warlock, Hunter, and Titan; they provide different playstyles depending on their specialization and unique abilities. To develop the character you can gain experience points completing the story and side missions.","Action, Shooter","Singleplayer, Multiplayer, Full controller support, Atmospheric, Great Soundtrack, Co-op, Open World, cooperative, First-Person, Sci-fi",2017-09-06,3.52,"PlayStation 4, Xbox One, PC, Web, Xbox Series S/X, PlayStation 5",https://media.rawg.io/media/games/34b/34b1f1850a1c06fd971bc6ab3ac0ce0e.jpg
3070,fallout-4,Fallout 4,"The fourth game in the post-apocalyptic action RPG series from Bethesda studious brings players back to the retro-future. After customizing the facial features of the character, players will be admitted to the Vault 111 with their family, and tricked into entering the cryogenic capsule. After the rude awakening after the unknown amount of time has passed, the child is separated from the parents and the loving partner is killed in front of them – the main quest is settled. Now there’s only the giant open world to explore. Fallout 4 introduces the mechanics of settlement building, where players can build their own little town. Gathering material for crafting and building brings more “survival” elements into the old formula. Within their own settlements, players will be able to build all needed utilities, from storage spaces to power armor stations. Visual upgrade from the previous game brings life to what used to be brown wastelands, now filled with details and color.","Action, RPG","Singleplayer, Steam Achievements, Full controller support, Steam Cloud, Atmospheric, Great Soundtrack, RPG, Story Rich, Open World, First-Person",2015-11-09,3.81,"PlayStation 4, PC, PlayStation 5, Xbox One",https://media.rawg.io/media/games/d82/d82990b9c67ba0d2d09d4e6fa88885a7.jpg
3939,payday-2,PAYDAY 2,"The gang is back, and they have bigger and better plans. Objective based cooperative FPS became more complicated. The classic group of Hoxton, Dallas, Chains and Wolf got reinforcement, and now Payday Gang consists of 21 heisters, some of which are based on movie characters or even Youtubers. Players will be able to customize their own private arsenal, their masks, and skills, to complete the missions in their own way, be it stealthy sneak-in or full frontal assault. After completing missions, players will receive EXP points, money and a chance to get a special item that can be a gun modification, mask or a safe containing weapon skins.
Payday 2 is a multiplayer game, meaning, that even during offline missions players will be followed by AI characters, whose loadouts, masks and perks can be customized as well. This game has been supported by the developers for many years, and amount of DLC speaks plenty of their dedication to the player base.","Action, Shooter","Singleplayer, Steam Achievements, Multiplayer, Full controller support, steam-trading-cards, Great Soundtrack, Co-op, cooperative, First-Person, FPS",2013-08-13,3.52,"Linux, PC, Xbox One",https://media.rawg.io/media/games/73e/73eecb8909e0c39fb246f457b5d6cbbe.jpg
1030,limbo,Limbo,"This popular 2D puzzle-platformer creates the atmosphere of isolation, where the player alone can guide the nameless protagonist to his destination. Hostile environments and one-hit deaths may seem difficult, but the game implements a fair amount of checkpoints. The monochrome color palette showcases cartoony proportions of every living thing while making lack of details threatening. Limbo shows you exactly what you encounter, but never how it looks.

Limbo uses the atmosphere and sound design of the horror genre while avoiding tropes of the modern horror games. The overarching theme and unique style compensated for the rather short game with an abrupt ending, making Limbo one of the most impactful games for the genre.

The simple controls and easy-to-pick-up mechanics help to make a clear distinction, which part of the stage players can interact with, and which part can lead to the quick death. Even though the game is in black and white, this separation is intuitive and natural, so the player would know exactly where to go or what to do.","Action, Adventure, Indie, Puzzle, Platformer","Singleplayer, Full controller support, Atmospheric, 2D, Horror, Difficult, Action-Adventure, Pixel Graphics, Controller, Dark",2010-07-21,4.14,"PC, Android, PS Vita, PlayStation 4, PlayStation 3, Xbox 360, Linux, macOS, iOS, Xbox One, Nintendo Switch",https://media.rawg.io/media/games/942/9424d6bb763dc38d9378b488603c87fa.jpg
11859,team-fortress-2,Team Fortress 2,"TF2 is an objective based arena shooter with unique characters, representing different classes, acting as a staple of casual and competitive gaming for Steam. Dozens of different maps and game modes are trying to keep this game alive, after all the years it was available. Each character has a vast arsenal that can be accessed through completing in-game achievements, randomly receiving them from loot-boxes within the game, crafting them or just buying and trading items on the Steam Market. 
For players, that's not into the direct clash with players from the enemy team, Team Fortress 2 introduced a PvE mode, which is wave defense from the mirrored robotic opponents that have qualities of some of the playable classes. 
Every update and introduction, made over years, provided a lot of entertainment In the form of comic books an short animated videos, creating and explaining a story behind endless clashes for resources, briefcases or pure domination.","Action, Shooter","Steam Achievements, Multiplayer, steam-trading-cards, Co-op, cooperative, First-Person, Partial Controller Support, FPS, Online Co-Op, Funny",2007-10-10,3.68,"PC, macOS, Linux",https://media.rawg.io/media/games/46d/46d98e6910fbc0706e2948a7cc9b10c5.jpg
